{"case_id":"m3-f02","errors":[],"execution_authorization":{"authorization_token":"cf656f33434f470fc597fa538ade90b161a328af32cd5e5839f3d10efff01add","path":"evals/m3/forward-inputs-r5.1-f02/execution-authorization.json","raw_sha256":"aec40aef8e855cd42464080066f475bf3d05de5ef8a2936d8f12750783af81ff"},"fresh_task_id":"019fdb7c-1728-7a92-b6cf-b0eb631a18b8","historical_task_reused":false,"launch_count":1,"launch_status":"launched","no_retry":true,"revision":"r5.1-f02","schema_version":"m3.1-forward-r5.1-f02-launch-receipt-v1"}
